Digital Technology Cluster,"ADM AI Ramp Fluidity ADM AÃ©roports de MontrÃ©al is aiming to improve the passenger experience and reception by deploying a web-based solution that will enable users of YUL MontrÃ©al-Trudeau Airport to better plan their trips. Using AI and congestion data, this technological solution will provide personalized information on travel time to the airport based on departure time, flight and destination, as well as proposing alternative options available to reduce wait times for accessing the airport. Given the current traffic levels, and in conjunction with the major work scheduled to begin shortly at YUL that will carry on over the next decade, this tool will enhance the passenger experience, and is therefore at the very heart of the mitigation measures deployed to ease traffic on the main drop-off area in front of the terminal.",ADM Aeroport de MontrÃ©al,General,1.36,17.58,06/04/2024,"Montreal, QC"
Digital Technology Cluster,"WorkSafe AI The WorkSafe AI project, led by OVA Inc. in collaboration with ArcelorMittal Long Products Canada and the research institution CDRIN, is a groundbreaking initiative designed to revolutionize safety standards in steel manufacturing through advanced AI technologies. The project focuses on enhancing workplace safety by integrating and substantially reducing workplace incidents, including severe injuries and fatalities, by equipping workers with enhanced hazard recognition skills and safety awareness. The collaboration brings together industry expertise, advanced AI research, and practical application, setting a new benchmark in industrial safety practices. This initiative is not only expected to create a safer manufacturing environment but also aligns with ArcelorMittal's commitment to employee safety and operational excellence.","OVA Inc., ArcelorMittal Produits longs Canada",General,0.64,2.17,06/04/2024,"Contrecoeur, QC"
Digital Technology Cluster,"Improving last mile delivery with AI-generated indoor maps Mappedin and its partners propose to build tools that can create indoor maps and annotations with much greater efficiency through AI, machine learning and improved tooling. The goal is to reduce mapping costs by 50% or more compared to existing methods - tracing and annotating raster images manually. The end result will be a proven product that makes it economical for delivery companies to invest in venue map coverage because of the resulting cost savings to last mile deliveries.","Mappedin Inc., Shippie Technologies Inc., Rogers Communications Canada Inc., Communitech, Uni Express Inc.",General,0.75,2.51,06/04/2024,"Waterloo, ON"
Digital Technology Cluster,"Leveraging AI for Patient Segmentation and Medication Adherence Forecasting Bayshore HealthCare Ltd. is revolutionizing patient care and medication adherence. This project involves the development of two interconnected AI solutions: a Patient Segmentation Model and an Adherence Forecasting Model. By leveraging AI technology, the Patient Segmentation Model will categorize patients based on various factors, enabling Bayshore's Patient Support Program Case Managers to determine the most suitable care pathway for everyone efficiently. This will significantly reduce registration time. Additionally, the Adherence Forecasting Model will predict the primary causes of non-adherence, allowing Bayshore to provide personalized interventions and support to patients at risk. This will result in enhanced medication adherence. Through collaboration with Deloitte Inc., Manifold Data Mining Inc., and Architech Solutions Consulting Services Inc., Bayshore aims to streamline the patient journey, improve health outcomes, and alleviate the strain on the Canadian healthcare system.",Bayshore HealthCare Ltd.,General,1.92,6.3,06/04/2024,"Mississauga, ON"
Digital Technology Cluster,"AI Enabled Control Tower for End-To-End Supply Chain Visibility & Support Cavendish Farms Corporation, a leading frozen potato product processor in North America, has partnered with Deloitte, and Nuvoola AI to implement a Control Tower platform. This platform, powered by data and AI capabilities, aims to improve decision-making processes in procurement, raw product processing, inventory management, and order fulfillment. By leveraging the expertise of these collaborators, Cavendish Farms seeks to optimize factory performance, enhance inventory management, and streamline order prioritization. This collaborative project aligns with the broader objective of bolstering resilience in the Canadian farming and food manufacturing sector, supporting local growers, and reducing dependence on imports.",Cavendish Farms Corporation,General,2.94,7.83,06/04/2024,"Dieppe, NB"
Digital Technology Cluster,"Autonomous Procurement Pricing System This project is leveraging AI technology to predict component pricing in the supply chain of industrial automation solutions. This consortium, led by ATS Corp., will work with AI consulting firm Waterloo Analytics to generate a new component pricing tool, analyzing custom 3D computer-aided design (CAD) parts to predict job pricing and improving supply chain workflows. This system will deliver higher accuracy into supplier costing, job forecasting, and streamlined vendor engagements.","ATS Automation Tooling Systems Inc., Waterloo Analytics, Demtool Inc., University of Waterloo, OERP Canada",General,0.94,2.49,09/28/2023,"Cambridge, ON"
Digital Technology Cluster,"AI-driven Subcontractor, Labor and Equipment Management The principal goal of this AI-centric initiative is to engineer a forward-thinking predictive tool for the construction supply chain. This project will enable subcontractors and other stakeholders to improve their performance by leveraging AI-driven construction software to optimize their cost management, resource allocation, and project scheduling, leading to increased efficiency and competitiveness in the market.","EllisDon Holdings Inc., Yeji Data Lab, Guild Electric Limited, Stephenson Rental Services, VR Mechanical Services",General,1.68,4.62,09/28/2023,"Toronto, ON"
Digital Technology Cluster,"Resilient Supply Chains through Well Maintained Transportation Systems In this project, Visual Defence has partnered with innovative Canadian municipalities to enhance different aspects of road maintenance programs and deliver even more impact through data driven decisions and results. With the support of ScaleAI, Visual Defence will work together with project partners to push the envelope further, helping our public sector partners to accomplish even more with their existing resources. This project is anticipated to reduce maintenance and operating costs for vehicles, reduce the incidence of collisions, improve traffic flow and supplies, and much more.","Visual Defence Inc., The Regional Municipality of York, City of Windsor, Michel Gendreau, Keenline Innovation",General,0.88,2.27,09/28/2023,"Richmond Hill, ON"
Digital Technology Cluster,"Self-learning Routes for Optimized Recharging This project will see the development of a platform that aims to accelerate the widespread adoption of electric vehicles by strengthening Canada's position as the innovation hub for Electric vehicle routing and charging scheduling. In collaboration with IVADO Labs, the ClÃ©o platform will introduce an innovative AI model capable of autonomously learning and predicting future trips for electric vehicles, all while minimizing energy costs and alleviating strain on the electrical charging network. This project stands as a significant contribution to the pursuit of a more environmentally friendly and sustainable future in transportation.","ClÃ©o, IVADO Labs, Autobus SÃ©guin, Transco",General,0.35,1.6,09/28/2023,"Montreal, QC"
Digital Technology Cluster,"Revenue Management for Retail & Supply Chain through Artificial Intelligence The project aims to implement machine learning and operations research to streamline retail and supply chain processes. The goal is to create a system that optimizes order fulfillment and price markdowns, leveraging predictive analytics of demand and inventory levels. The innovative use of AI, the processing and analysis of the data, and the development of the algorithm will pave the way for broad-scale transformation and growth. Through this project, project partners are contributing to the elevation of Canada's status as a nexus for innovation in industry prognostics and predictive maintenance for supply chains and vehicles.","THE ALDO GROUP INC., IVADO Labs, Retailogists, ITL Group",General,2.91,14.48,09/28/2023,"Montreal, QC"
Digital Technology Cluster,"AI-based decision tool to forecast, optimize and allocate paramedic resources (PCAIS Project) This project will use machine learning-based modelling to better predict influxes of 9-1-1 calls and increase response times to medical emergencies. This solution will allow Urgences-SantÃ© to be more efficient and agile in balancing supply and demand of resources, which will improve the delivery of care and increase patient well-being.","Urgences-santÃ©, Airudi, McGill Clinical and Health Informatics, Emergency Medical Care Incorporated, Alberta Health Services -- Emergency Medical Services",PCAIS,1.2,2.34,09/27/2023,"MontrÃ©al, QC"
Digital Technology Cluster,"Emergency Dept AI-Enabled Virtual Triaging and Queue Management Application (PCAIS Project) This project will use AI in the emergency department of the Humber River Hospital to forecast patient influx, analyze resource availability, and deploy real-time solutions to align resources effectively, all aimed at improving health navigation for patients and enhancing operational efficiency. This innovative approach will significantly reduce patient wait times, improve staff workflows, and elevate overall patient satisfaction.","Humber River Health, Deloitte, Mackenzie Health, MEDITECH Collaborative (Queensway Carelton Hospital)",PCAIS,1.5,2.45,09/27/2023,"Toronto, ON"
Digital Technology Cluster,"Improvement of radiation therapy through staff scheduling optimization (PCAIS Project) This project will develop an AI solution to address critical challenges in radiation therapist scheduling. Using the power of AI, the solution will comprise of workload and absence prediction, monthly optimization, and daily adjustments, all driven by historical data and advanced algorithms, creating resilient schedules while ensuring coverage at hospitals and reducing disruptions to staff and patients.","UHN Princess Margaret Cancer Center, IVADO Labs, Southlake Regional Health Center, eSummit",PCAIS,1.2,1.65,09/27/2023,"Toronto, ON"
Digital Technology Cluster,"Tableau d'optimisation des ressources pour l'USIP (soins intensifs pÃ©diatriques) (PCAIS Project) This project will develop a dashboard, based on AI, to help the pediatric care unit (PICU) of the Sainte-Justine University Hospital Centre to optimize their staffing and other resources to accelerate admission and transfer of patients, thereby reducing delays in patient care (for example, lower surgery cancellation rates). This AI solution will make it possible to determine the workload of the unity in advance by predicting planned new admissions while limiting room transfers of patients already hospitalized in the PICU.","C.H. Universitaire Ste-Justine, IVADO Labs, HÃ´pital de MontrÃ©al pour Enfants",PCAIS,1.2,1.79,09/27/2023,"MontrÃ©al, QC"
Digital Technology Cluster,AI-Driven Demand Forecasting for CIUSSS West-Central Logistics Optimization (PCAIS Project) The objective of this initiative is the deployment of an AI system specifically designed to enhance and streamline the logistics of the CIUSSS West-Central warehouse through precise demand forecasting.,"Jewish General Hospital, CIUSSS West-Central Montreal, IVADO Labs",PCAIS,1.2,1.66,09/27/2023,"MontrÃ©al, QC"
Digital Technology Cluster,"AI-Driven Physician Scheduling Solution and Workflow Optimization (PCAIS Project) Through this project, Fraser Health will harness the power of AI to forecast patient demand and optimize physician scheduling in the emergency and hospital medicine departments. These AI-driven initiatives are set to significantly improve operational efficiency, reduce patient wait times, enhance health outcomes, and cultivate a better working environment for staff. By integrating AI in these critical areas, Fraser Health will further solidify its position as an innovator and leader in healthcare, delivering on its commitment to excellent patient care and optimal service delivery.","Fraser Health Authority, Deloitte, Burnaby Hospital, Eagle Ridge Hospital",PCAIS,1.5,2.23,09/27/2023,"Surrey, BC"
Digital Technology Cluster,"Developing the first patient-centric care management system for oncology (PCAIS Project) This project focuses on developing, deploying, and evaluating software to address three key challenges in oncology: the stochastic nature of patient flow, the difficulty of proactive capacity planning and the coordination of multiple services that a single patient may require throughout their care trajectory.","The Ottawa Hospital, Centre hospitalier de l'UniversitÃ© de MontrÃ©al, Gray Oncology Solutions, The Jewish General Hospital, University Health Network, Programme QuÃ©bÃ©cois de CancÃ©rologie, Centre intÃ©grÃ© de santÃ© et de services sociaux de Laval, McGill University Health Centre, Southlake Regional Health Centre, CIUSSS de l'Estrie -- Sherbrooke, Canadian Cancer Society",PCAIS,1.64,2.72,09/27/2023,"MontrÃ©al, QC"
Digital Technology Cluster,Optimizing Emergency Department Patient Prioritization (PCAIS Project) The collaborative project between Signal 1 and the hospital consortium will provide emergency department staff with a tool to better manage patient flow. The project will deploy real-time AI systems in a hospital emergency department to optimize scarce emergency department resources and accelerating patient discharge. Signal 1's system uses patient charting data to predict the likelihood that a patient is disposition-ready.,"Unity Health Toronto, Signal 1 inc., St Michael's Hospital, St. Joseph's Health Centre, Trillium Health Partners, Grand River Hospital",PCAIS,1.5,2.97,09/27/2023,"Toronto, ON"
Digital Technology Cluster,"Scaling and adoption for AI-based medtech ventures Scale AI's Acceleration program provides funding to accelerators and incubators to support the growth of AI startups and SMEs across Canada. The Cluster is investing in MEDTEQ based in Montreal. This is a support program for technology companies (AI, logistics, IT, 4.0) that are active in Canada's health supply chains, and/or who can drive disruptive innovations therein. It is a flexible program, addressing the innovation, commercialization, legal and data management challenges, and adapting to each start-ups/SMEs' degree of maturity.",MEDTEQ,General,0.18,0.18,04/04/2023,"Montreal, QC"
Digital Technology Cluster,"Momentum Scale AI's Acceleration program provides funding to accelerators and incubators to support the growth of AI startups and SMEs across Canada. The Cluster is investing in the MAIN - Mouvement des accÃ©lerateurs d'innovation du QuÃ©bec based in QuebÃ©c. Through PMEit, MAIN aims to accelerate investments and increase the turnover and access to financing of the companies it supports. PMEit proposes an innovative management approach based on collaboration and the pooling of resources.",MAIN - Mouvement des accÃ©lÃ©rateurs d'innovation du QuÃ©bec,General,0.12,0.14,04/04/2023,"Quebec City, QC"
Digital Technology Cluster,"Thales AI@Centech Scale AI's Acceleration program provides funding to accelerators and incubators to support the growth of AI startups and SMEs across Canada. The Cluster is investing in Thales, based in Montreal. Run by Thales in cooperation with Centech, this program aims to accelerate startups by giving them guidance and access to Thales' expertise and technological platforms to co-build cutting-edge solutions.",Thales,General,0.07,0.6,04/04/2023,"Montreal, QC"
Digital Technology Cluster,"The DMZ - Supply AI Program Scale AI's Acceleration program provides funding to accelerators and incubators to support the growth of AI startups and SMEs across Canada. The Cluster is investing in The DMZ (Toronto Metropolitan University) based in Toronto. With a focus on AI-powered supply chains the DMZ is introducing a specialized remote program to support Canada's entrepreneurs in the place they call home. The DMZ's Supply AI program incubates and accelerates AI startups that are otherwise limited by geography, and works to increase Canada's capacity to support the growth of AI ventures.",Toronto Metropolitan University - The DMZ,General,0.4,2.3,04/04/2023,"Toronto, ON"
Digital Technology Cluster,"North of AI -- Learning and Business Accelerator Scale AI's Acceleration program provides funding to accelerators and incubators to support the growth of AI startups and SMEs across Canada. The Cluster is investing in Tech Yukon, based in Whitehorse. The main areas of focus for this program is to promote and grow the local tech industry, provide skill development and training opportunities around AI and machine learning, support local tech entrepreneurs, and support other industries with supply chain challenges. Support will be provided to industry led projects aimed at fast-tracking the adoption and commercialization of AI for supply chains.",TechYukon,General,0.06,0.35,04/04/2023,"Whitehorse, YT"
Digital Technology Cluster,ventureLAB Accelerate AI (VAAI) Scale AI's Acceleration program provides funding to accelerators and incubators to support the growth of AI startups and SMEs across Canada. The Cluster is investing in the ventureLAB Innovation Centre based in Markham. ventureLAB's Accelerate AI program (VAAI) supports growing and scaling Canadian AI hardware and software startups in the supply chain industry.,ventureLAB Innovation Centre,General,0.25,0.62,04/04/2023,"Markham, ON"
Digital Technology Cluster,"Plug and Play Supply Chain & Logistics Scale AI's Acceleration program provides funding to accelerators and incubators to support the growth of AI startups and SMEs across Canada. The Cluster is investing in Plug & Play Innovation Canada Inc. based in California. Plug and Play is an open innovation platform that will be connecting Canadian entrepreneurs with local businesses and industries. Greater Toronto is home to a growing hub of startups, which Plug and Play Canada is looking to identify, support, and accelerate through its vast global network of entrepreneurs, mentors, VCs, and corporate decision makers. Key focus areas of Plug and Play Canada include the fields of Artificial Intelligence in Supply Chain & Logistics.",Plug and Play Innovation Canada Inc.,General,0.18,1.12,04/04/2023,"Mississauga, ON"
Digital Technology Cluster,"Co.Labs Scale AI's Acceleration program provides funding to accelerators and incubators to support the growth of AI startups and SMEs across Canada. The Cluster is investing in Co.Labs based in Saskatoon. Co.Labs is designed to identify high-potential founders with a validated software- or hardware-based technology, and provide all the tools and contacts they need to raise investment, improve product-market fit, get the right team in place, and ultimately scale their respective companies to $1 million in annual recurring revenue. Co.Labs would use Scale AI support to establish a network of contacts and mentors in the AI research and supply chain/logistics spaces, then contract these individuals to work intensively with eligible early-stage entrepreneurs and teams at Co.Labs toward solving complex problems related to product development and commercialization.",Co.Labs,General,0,0.18,04/04/2023,"Saskatoon, SK"
Digital Technology Cluster,"Guay - Crane Allocation Optimization This intelligent dispatch project addresses the optimization of crane and operator dispatch on different contracts. With the help of artificial intelligence, Guay has developed a solution that allows it to address several issues in the dispatching of its personnel and equipment, in complex bids as well as in the prediction of service demand.","Guay, QSL, Vooban, Toitures Falardeau",General,2.93,8.56,02/13/2023,"Quebec City, QC"
Digital Technology Cluster,"Routeique AI-Enabled Warehouse Digital Twin This project will focus on orchestrating warehouse operations to maximize warehouse efficiency across three interconnected use cases; space use optimization, pick route optimization and sequencing, and demand forecasting and sensing.","Routeique, Big Rock Brewery, Amii - Alberta Machine Intelligence Institute",General,1.34,3.55,02/13/2023,"Calgary, AB"
Digital Technology Cluster,"Supply Chain AI for Circular Manufacturing Feedstock Solution The projects key goal will be to develop an AI-based supply chain solution to source feedstock in the appropriate quantity, quality, and blend to allow for the circular manufacturing of virtually all types and blends of plastics.","Macrodyne Technologies, ReGen Composites, Simwell Consulting & Technologies Inc., Les Technologies MOOVAI, Institute Intelligence and Data (IID)",General,2.2,5.28,02/13/2023,"Concord, ON"
Digital Technology Cluster,"MDI x AI This project will assist in propelling its market position in potato processing and packaging, McCain will be developing and deploying an integrated set of digital tools that connect its supply chain partners, from potato growers to finished goods at the customer level. These tools will be powered by AA/AI and will be leveraged throughout factories and in varying use cases to increase supply chain transparency, food quality and safety, and to enhance employee safety.","McCain Foods, The Boston Consulting Group, Fiddlehead Technology, Lemay.ai, Tribal Scale, Dalhousie University, Gaia Consulting, Ross Culberson Farms, Riverview Farms, Valley Farms, Killoween Farms",General,8.46,35.88,02/13/2023,"Florenceville, NB"
Digital Technology Cluster,"CTC - Promotion Optimization This project will explore different ways of helping Canadian Tire Corporation find efficient ways to increase incremental sales and margin for all products, by applying AI-powered technologies in the promotional initiatives of the business. The proposed framework focuses on a foundational first use case that will use ML and AI to evaluate the performance of promotional plans for groups of products.","Canadian Tire Corporation, IVADO Labs, Shakudo",General,3.49,8.03,02/13/2023,"Toronto, ON"
Digital Technology Cluster,Aircraft Parts Affinity Recommendation with AI This project will allow Bombardier to represent national capabilities in aerospace and AI and position them to share their non-competitive insights and knowledge with research organizations such as NERC. This could foster further improvement in the methodologies developed through research programs funded through the benefits generated by the present project's results.,"Bombardier, IVADO Labs, Xennial Innovation",General,1.46,3.63,02/13/2023,"Montreal, QC"
Digital Technology Cluster,"Intelligent structural steel design and estimating system This project will standardize, digitize and automate the cost estimation process by leveraging the technological advances of our era to create an Intelligent Structural Steel Design and Estimating System","Canam Group, Les Technologies MOOVAI, CICIEM (Concordia University), Read Jones Christoffersen, McIntosh Perry",General,1.07,2.76,02/13/2023,"Boucherville, QC"
Digital Technology Cluster,"AI to augment capabilities in early issue handling Leveraging proven AI methods, this project aims to provide digital tools to experts to maximize early design problem solving to avoid cost overruns and optimize planning and effort.","BIM One, Les Technologies MOOVAI, Groupe Nexapp",General,0.91,2.61,02/13/2023,"LÃ©vis, QC"
Digital Technology Cluster,AI-Powered Experience and Profit Optimization The projects key goal is to increase the overall basket profitability through increased revenue and margins while minimizing the costs of these supply chain activities by providing product recommendations that consider supply chain impacts.,"Coveo, IVADO Labs, Metro, Boulangerie HumanitÃ©",General,9.25,25.31,02/13/2023,"Montreal, QC"
Digital Technology Cluster,"Recommendation engine for ancillary upgrade system This project aims to elevate how airlines capture incremental revenues with the development of AI-based solutions such as virtual assistants. The result is intended to be positive customer experiences and clear returns on investments. With the introduction of a virtual assistant, airlines will be able to yield more potential revenues and, through a diversification of their revenue sources, the ability to generate ancillary revenue will increase the financial performance and stability of airlines.","plusgrade, Air Canada, Air Transat",General,1.81,5.22,11/14/2022,"MontrÃ©al, QC"
Digital Technology Cluster,"Trade Promo Optimization This projects main objective is to provide an end-to-end promotion optimization recommendation engine to help the consortium members increase their ability to accurately predict consumer reaction to pricing and promotions, creating seamless integration between suppliers, retailers and the analytics ecosystem.","Larus Technologies Corporation, Theory & Practice, Southern Ontario Smart Computing for Innovation Platform, Unilever Canada, Federated Co-operatives Limited (FCL",General,0.77,2.63,11/14/2022,"Toronto, ON"
Digital Technology Cluster,Supply Chain Intelligence Platform for SMEs This project will develop predictive models around supply chain network risk. The AI solutions will allow SME users to understand better their supply chain risk through a single score.,"Freshbooks, MiSCAN Lab, BeneComm Inc., Oligomaster",General,0.95,2.84,11/14/2022,"Toronto, ON"
