Cluster,Project Title,Project Partners,Project Type,Global Innovation Clusters Funding (M),Total Project Value (M),Date of Announcement,Project Location
Digital Technology Cluster,"Virtual Pulse (COVID-19 Project) This project will address the training needs of over 500,000 current and aspiring nurses in Canada to respond to COVID-19, and become available to nurses and healthcare providers globally. This will assist hospitals as they respond to the COVID-19 pandemic by expanding capacity, re-training staff for new roles, and inviting retired healthcare workers to return to duty.","Technology Training Associates Ltd. (TTA), BCIT, Animism, Unity Technologies (formerly Finger Food Advanced Technology), CAE Healthcare, Fraser Health, Vancouver Coastal Health, First Nations Health Authority",COVID-19,2.2,3.15,08/06/2020,"Vancouver, BC"
Digital Technology Cluster,"DirectFood.store, Securing the Food Supply Chain (COVID-19 Project) This project will further develop and scale the DirectFood.store (DFS) platform -- a one-stop shop for consumers to source fresh food directly from local producers, all without warehousing, processing facilities, stores or other distributors. This will help address challenges to the supply chain, promoting healthy eating, responding to evolving consumer preferences, enabling traceability and transparency in the supply chain, and adapting to the Internet grocery revolution.","Wisebox, i-Open Technologies, Novex Delivery Solutions",COVID-19,1,1.5,08/06/2020,"Vancouver, BC"
Digital Technology Cluster,"Confidential Virtual Addiction Treatment for Healthcare Workers (COVID-19 Project) This project will provide critical healthcare workers that are struggling with substance abuse disease with 100% confidential, virtual, evidence-based treatment options during this period of increased need. It will also help to build a strong business case for widespread adoption of pre-disability substance use disorder treatment and the incorporation of this form of treatment into existing healthcare worker employee benefit plans.","ALAViDA, Portage, Digital Health Circle, BC Nurses' Union (BCNU), Hospital Employees Union (HEU), BC Government - Ministry of Health, Health Sciences Association, Pacific Blue Cross",COVID-19,0.82,1.01,06/04/2020,"Vancouver, BC"
Digital Technology Cluster,"Stronger Together: Social Infrastructure for Community Health (COVID-19 Project) This project will aim to keep patients healthy at home and socially supported; give healthcare providers a single, compliant solution for remote monitoring; and provide researchers and other health organizations with an open platform on which they can build, share and monetize their evidence-based programs and services.","Curatio Networks, Cloud DX, Interior Health Authority, UBC, Pacific Blue Cross, Simon Fraser University, University Health Network (UHN), Wellness Garage, On Call Health, Zu.com",COVID-19,1.41,1.88,06/04/2020,"Vancouver, BC"
Digital Technology Cluster,"Early Detection of COVID-19 through Artificial Intelligence (COVID-19 Project) This project will use existing security cameras and computer vision technology to develop a passive screening system to identify people with a fever and who are at risk of having COVID-19, protecting the health and safety of Canadians. It will be an important tool that will enable the scanning of large numbers of people in hospitals, stores and airports. This will expedite the early detection and mitigation of potential infections, which will be critical to flattening the curve and minimizing future waves of pandemic outbreaks.","Patriot One, Cisco Canada, UBC, rProcess Outsourcing, Cramer Securities, iDENT Intelligent Detection Cincinnati Reds Stadium, Maryland Hospital",COVID-19,4.5,5.21,06/04/2020,"Vancouver, BC"
Digital Technology Cluster,"Digital Telework for Remote Physical Work (COVID-19 Project) This project will address the two most vulnerable Canadian populations affected by COVID-19: senior citizens and frontline healthcare workers by expanding the capabilities of telework technology, currently limited to video and audio interactions, to enable physical interactions by connecting and controlling general purpose robots from anywhere with LTE (4G/5G) networks. This will allow labour intensive industries to participate in the remote work economy with immediate application in healthcare and eldercare markets where urgent intervention is required.","Sanctuary AI, Blackbird Interactive, Expeto, UBC, Revera, AInBC, Alpine Building Maintenance, Forcen Technologies, Microsoft, Rogers, Vancouver Economic Commission, Nurse Next Door",COVID-19,4,5.68,06/04/2020,"Vancouver, BC"
Digital Technology Cluster,Digital Mental Health Tools for Healthcare Workers Providing COVID-19 Care (COVID-19 Project) This project will build a suite of best practices and digital mental health tools & training for the Canadian workforce - with an initial focus on the unique needs and stressors of healthcare workers on the frontline of the COVID-19 pandemic.,"Starling Minds, UBC, Genome BC",COVID-19,2,2.53,06/04/2020,"Vancouver, BC"
Digital Technology Cluster,"Providing Safe and Effective Home Care During COVID-19 (COVID-19 Project) This project will make broader enhancements to the AlayaCare home health care platform by leveraging the vast footprint of AlayaCare deployments across Canada while integrating solutions and platform components from other project partners. This will enhance the existing technology, and create new digital tools for risk management that will serve to protect the home healthcare industry from this pandemic and future pandemics. This includes taking a longer-term approach and working with partners to strengthen application programming interface as well as enabling data utilization for health data studies. The platform will accelerate patient pre-visit mandatory screening, schedule optimization for homecare providers, and real time alerting of symptomatic employees or patients.","AlayaCare, Careteam, AceAge, e-Cobalt, University of Victoria, Saint Elizabeth Health Care, Partners in Community Nursing (PICN), Paramed, Fraser Health, Acclaim Health, Bayshore HealthCare",COVID-19,0.96,1.62,05/26/2020,"Vancouver, BC"
Digital Technology Cluster,"Improving ICU Capacity During COVID-19 Outbreaks (COVID-19 Project) This project will leverage and advance development of Altis' image-based patient outcome prediction technology for COVID-19 inpatients to predict ICU admission and expected date of discharge. Clinicians will be able to make better decisions sooner regarding capacity of beds, staffing, and ventilators during patient surges, leading to higher quality care, efficiency gains, and better patient outcomes.","Altis Labs, Bayer AG, Quantitative Imaging for Personalized Cancer Medicine, Trillium Health Partners, United Health Network (UHN), Princess Margaret Hospital, Toronto Western Hospital, Toronto General Hospital",COVID-19,0.93,1.28,05/26/2020,"Vancouver, BC"
Digital Technology Cluster,Rapid Deployment of Emergency Case Management (COVID-19 Project) This project will enable rapid cross-organization coordination of both health and social services for people in at-risk situations who are isolated in the community during public health and environmental crises such as COVID-19. This platform will initially be deployed in the Ottawa area focused on fragile seniors with aims to enhance the platform for concurrent provincial/national expansion.,"Careteam, The Ottawa Hospital, Caredove, AlayaCare, CognisantMD, University of Ottawa, Dementia Society of Ottawa and Renfrew County (DSORC)",COVID-19,0.54,0.54,05/26/2020,"Vancouver, BC"
Digital Technology Cluster,"Point-of-Care Ultrasound for COVID-19 (COVID-19 Project) This project will deliver AI and expert-supported point-of-care ultrasound for immediate COVID-19 diagnosis, and create the first gold-standard pulmonary ultrasound dataset in North America for COVID-19.","Providence HealthCare, Clarius, Change Healthcare, Vancouver Coastal Health (VCH), UBC, Rural Coordination Centre of BC (RCCbc)",COVID-19,0.5,0.68,05/26/2020,"Vancouver, BC"
Digital Technology Cluster,"Protecting Canadians by Predicting the Evolution of COVID-19 (COVID-19 Project) This project will develop a computational model that accurately predicts the conformational structure of mutant versions of the SARS-CoV-2 Viral Spike Protein Receptor Binding Domain (RBD), and an index of functionally permissible point mutants, thereby permitting pre-emptive development of tests, vaccines and therapies against likely variants that will arise once herd immunity is established.","Terramera, Naussler Biosciences, Microsoft, D-Wave, Menten AI, UBC, ProMIS Neurosciences",COVID-19,1.83,2.07,05/26/2020,"Vancouver, BC"
Digital Technology Cluster,"xrAI (COVID-19 Project) This project will develop a medical software that applies AI and machine learning to improve the accuracy and interpretation of chest X-rays, and diagnosis of COVID-19 patients. This tool supports clinicians by identifying lung abnormalities on chest radiographs within their existing clinical workflow and was recently fast tracked for approval by Health Canada. The AI software will enable clinicians to save lives through the early identification of COVID-19 and other respiratory diseases such as SARS, pneumonia, and tuberculosis.","1Qbit, Saskatchewan Health Authority, Fraser Health Authority, First Nations Health Authority, Trillium Health Partners, Microsoft",COVID-19,2,2.81,05/07/2020,"Vancouver, BC"
Digital Technology Cluster,"Athena Pathways This capacity building project will help more Canadian women see the potential of the tech sector, and how a career in AI could align with their skills and interests. Through training programs in computing science, as well as internship and mentorship programs, this project will support Canadian tech companies to fill job vacancies and, in turn, become more competitive while addressing the gender gap in AI.","Artificial Intelligence Network of BC (AInBC), UBC, SFU, BCIT, Northeastern University, Teck Resources, MetaOptima, Careteam, D-Wave, SCWIST, KPMG, Microsoft",General,0.06,0.87,01/16/2020,"Vancouver, BC"
Digital Technology Cluster,Augmented Reality for Maintenance and Inspection This project will revolutionize aviation maintenance by building a new augmented reality engine to allow aircraft inspectors to examine historical and current data in order to compare a plane's current state to its state during previous inspections. Learnings from this project could lead to a host of applications that leverage augmented reality for the inspection of large objects across the transportation industry and beyond.,"Boeing Vancouver/Aeroinfo, Unity Technologies (formerly Finger Food Advanced Technology), SFU",General,0.23,0.56,01/16/2020,"Vancouver, BC"
Digital Technology Cluster,"Autonomous Systems Technician Project partners will tackle talent shortages by equipping students with the skills needed to install and maintain autonomous telecommunications systems through a new certification program based on BCIT's existing Telecommunications System Technician diploma. This program will have additional content to meet the needs of natural resource companies and remote communities today, and will focus on training women, Indigenous peoples, and youth who are currently under-represented in the field. As resource companies shift to operating remote facilities with real-time sensors and systems, the program will prepare students to work with innovative technologies such as AI, IoT and machine learning to enhance operations, ensure worker safety, monitor equipment, and increase productivity.","College of the Rockies, Teck Resources, BCIT,",General,0.08,0.82,01/16/2020,"Kootenay Region, BC"
Digital Technology Cluster,"CAMPFIRE This project will help mid-career workers gain skills needed to thrive in the digital economy. The Competency Assessment Mapping Platform will personalize services to individual users' needs and will be driven by their actual skills and competencies rather than simply basing the process on credentials. The project will initially focus on three key economic sectors: forestry, healthcare, and mining, and is expected to help impacted workers reduce their time to re-employment by 25 percent. It is also designed to be scalable and extended to other sectors, providing a much-needed approach for building capacity and supporting workforce transformation across the Canadian economy.","BCIT, Immigration Employment Council of BC Society (IECBC), LifeLabs",General,0.07,0.52,01/16/2020,"Vancouver, BC"
Digital Technology Cluster,"Design for Startups This project will connect design students with technology startups through intensive 12-week sessions to develop applied solutions to product design problems. The project aims to bridge the gap between the technology and design communities in order to improve digital products, platforms and services. This hands-on program will help advance the careers of emerging designers and advance the core product offering of up to 40 regional startups.","Emily Carr University of Art & Design, BC Tech, A&K Robotics, CoPilot AI, Innovate BC, 40 technology start-ups",General,0.06,0.47,01/16/2020,"Vancouver, BC"
Digital Technology Cluster,"Diversifying Talent in Quantum Computing This outreach project will work with youth and Indigenous education leaders to ensure that students are aware of career opportunities in the quantum computing space. The program will deliver ready-to-use education kits and curriculums through workshops, summer camps, specialized programming for girls and Indigenous students, teacher training through an online quantum computing resource hub and a bi-weekly 'Quantum bit' podcasts that will host well-known international academics and industry experts.","UBC, D-Wave, Microsoft",General,0.06,0.5,01/16/2020,"Vancouver, BC"
Digital Technology Cluster,"Fresh Water Data Commons This project will pilot a platform to harness water monitoring data from a river basin in B.C. to better understand the health of the surrounding ecosystem, and the relationship between water quality, microorganisms, and industrial activities. Real-time data will be collected across the pilot area with a network of low-power, low-cost sensors in the environment to measure water quantity, water quality, as well as climate data, including precipitation. This platform offers a new monitoring tool that can help every part of Canada -- and the world -- use data to improve regional water management, and ultimately protect water, people, ecosystems and the economy as the demand for fresh water continues to rise.","Carl Data, Teck Resources, Microsoft, Astra Smart Systems, I4C Innovations, Living Lakes Canada, University of Victoria, Genome BC",General,1.62,4.96,01/16/2020,"Vancouver, BC"
Digital Technology Cluster,"Future Capital This project will provide investment education to 500 women, enabling them to lead and shape the future of the economy. By providing female leaders with the skills to invest in early-stage ventures, this program will help women to participate in the next generation of high-growth businesses and close the gender gap.","Female Funders, Microsoft, SFU",General,0.11,1.2,01/16/2020,"Vancouver, BC"
Digital Technology Cluster,"HyperTalent This project will tackle the tech talent shortage by working with K-12 urban and rural educators to build awareness around careers in technology, and connecting school curriculums with real-world examples of the opportunities ahead. The program will also provide a number of Indigenous youth with hands-on exposure to the tech sector through industry internships at leading technology companies. This broader approach will help youth align their interests and skills with prospective careers.","BC Tech Association, Accenture, Arrow Lakes School District 10, BCIT, Microsoft, Providence Health Care, St Paul's Foundation, SAP, Unbounce, Vancity, Vancouver School Board",General,0.07,0.45,01/16/2020,"Vancouver, BC"
Digital Technology Cluster,"Intelligent Network for Point-of-Care Ultrasound This project will develop a bedside tool for doctors that combines machine learning, handheld ultrasound devices and a cloud-based platform to create an integrated and intelligent point-of-care ultrasound network to deliver faster, more accurate diagnoses to patients whether they reside in urban, rural or remote areas. This will position Canada as a leader in the development of integrated, point-of-care diagnostics while improving healthcare delivery and outcomes for Canadians.â€¯","Providence Health Care, Change Healthcare, UBC, Clarius, Rural Coordination Centre of BC (RCCbc), Natural Sciences and Engineering Research Council of Canada (NSERC), Canada Foundation for Innovation",General,0.65,2.56,01/16/2020,"Vancouver, BC"
Digital Technology Cluster,"Personal Health Wallet This project will use blockchain technology to create a personalized health wallet platform that will allow individuals to confidently manage their medical data with approved parties, while ensuring that their privacy and the security of their data is protected. This will enable patients to present a complete medical history to healthcare professionals when needed, including test results; prescription history; and treatment records, leading to more efficient and accurate diagnoses and treatment.","Molecular You, Stone Paper, UBC, Mitacs",General,0.54,1.38,01/16/2020,"Vancouver, BC"
Digital Technology Cluster,"Precision Agriculture to Improve Crop Health Project partners will be working to develop new pest and pathogen controls to improve crop health through the use of computational biochemistry, genomics, machine learning, and robotics. The project will identify and test new pest management formulations and their ability to attack specific fungi on specific crops. It will also look into how crops and pests interact with different pesticides, pesticide enhancers, and alternatives. The computing tools developed by this project will be applicable in other fields outside of agriculture, including medicine, biotechnology, chemistry, and computer science.","Terramera, Sightline, Compression.ai, BC Cancer, Trent University, SFU, Universtiy of Saskatchewan, Agriculture and Agri-Food Canada, Genome BC, Michael Smith Foundation for Health Research",General,2.66,7.33,01/16/2020,"Vancouver, BC"
Digital Technology Cluster,"Reducing Opioid Use for Pain Management This consortium will collect and centralize patient data from multiple sources to create a complete snapshot of a patient's treatment before and after surgery. Physicians face the challenge of needing to balance pain management, with prescribing adequate and effective medication for each patient. This project offers a solution with customized post-operation strategies for each patient through a monitoring system that will ensure doctors have the information they need to manage and reduce the prescription and use of opioids.","Careteam, Excelar Technologies, Providence Health Care, Thrive Health, UBC, BC Children's Hospital Research Institute, Xerus Medical, NRC, Mitacs.",General,1.71,4.38,01/16/2020,"Vancouver, BC"
Digital Technology Cluster,"W Venture This project will build capacity for female entrepreneurs with diverse backgrounds aimed at increasing the representation of women in the technology sector. As an entrepreneurship development program designed by women for women, it will support female entrepreneurs and their tech ventures through boot camps, workshops, mentorship and peer sharing on leadership skills. This project offers women a more meaningful and impactful experience than programs available through traditional incubators and accelerators.","Victoria Innovation, Advanced Technology and Entrepreneurship Council (VIATEC), Accelerate Okanagan, Purpose Five, Communitech, University of Victoria, Coast Capital Savings Innovation Centre (CSIC)",General,0.11,0.63,01/16/2020,"Victoria, BC"
Digital Technology Cluster,"Dermatology Point-of-Care Intelligent Network This project will use a cloud-based technology platform to reduce time-to-diagnosis and help improve patient care by training artificial intelligence (AI) models on real-life clinical data in order to create algorithms for clinical decision support. The project will use tele-pathology and tele-dermatology imaging augmented by AI to expedite urgent cases faster through e-referral and e-triage. This new platform will serve as a basis for building similar end-to-end processes in other image-intensive service lines such as Cardiology, Radiology, Pathology and Ophthalmology.","Change Healthcare, BC Cancer, MetaOptima, Careteam Technologies, Providence Healthcare, University of Victoria, UBC",General,3.63,9.85,03/02/2019,"Vancouver, BC"
Digital Technology Cluster,"Earth Data Store This project will see partners use earth observation data and environmental sensors to develop a comprehensive global imaging system for monitoring and predictive purposes. Through interactive visual maps and running deep learning algorithms, the project will foster cutting-edge analysis of Canada's vast forests, fields and mines to facilitate better observation and protection of remote areas. This will allow researchers, businesses, and government agencies to be able to make more informed decisions on a wide array of key environmental issues.","Urthecast, Sparkgeo, Microsoft, Geoscience BC, UBC, University of Victoria, Mitacs",General,1.73,3.94,03/02/2019,"Vancouver, BC"
Digital Technology Cluster,"Forest Machine Connectivity This project will use an Industrial Internet of Things (IIoT) platform -- which is a network of 'smart' devices that can monitor, collect, exchange and analyze data -- to develop an application that will be used to solve technical barriers that impact efficiency in the wood product manufacturing industry. This application will allow contractors, machine operators and forest managers to identify bottlenecks, improve productivity in real time and develop best practices throughout the timber harvesting supply chain.","Canfor, UBC, Mosaic Forest Management, Lim Geomatics, FPInnovations",General,3.27,7.77,03/02/2019,"Vancouver, BC"
Digital Technology Cluster,Predictive Analytics for Manufacturing Processes This project will see project partners create a digital twin of Avcorp Industries' metal finishing process line and uncover opportunities to capture key insights for fault detection. It will use Solid State AI's algorithms and D-Wave's quantum computers' capabilities to transform the fault-detection process from reactive to predictive-based solutions.,"D-Wave, Avcorp, Solid State AI, SFU, Mitacs",General,0.19,0.42,03/02/2019,"Vancouver, BC"
Digital Technology Cluster,"Tailored Health - Pharmacogenetics This project will use a digitally-integrated solution to combine an individual's genetic makeup with their biophysical, drug and medical history. The outcome will be a gene-based medication management system that integrates both Electronic Medical Records and Pharmacy Management Systems. This initiative will enable population-based risk assessments, enhance prescribing effectiveness, reduce adverse drug reactions, and deliver better health outcomes for Canadians.","TELUS, GenXys Health Care Systems, LifeLabs, Emily Carr University of Art and Design, Genome BC, Mitacs",General,2.05,4.73,03/02/2019,"Vancouver, BC"
Digital Technology Cluster,"Learning Factory Digital Twin This project brings industry, academia and researchers together to simulate and model industrial factory processes using real-time, data-driven technologies. This consortium will create a digital twin of two industrial production lines for complex Boeing aircraft parts. Partners will merge full-scale industrial production with technology to create new digitally-driven industrial tools in spatial planning, asset tracking, data collection and process automation.","Avcorp, Convergent Manufacturing Technologies, AMPD, Boeing/Aeroinfo, LlamaZOO, Microsoft, UBC",General,2.12,4.81,03/02/2019,"Vancouver, BC"
Digital Technology Cluster,"Secure Health & Genomics Platform Program This project will leverage the Cluster's ecosystem leaders in cloud computing, bioinformatics, data security, genome science and health services to aggregate health and genomic data across the country in order to develop a pan-Canadian digital heath platform that will improve the diagnosis and treatment of patients with cancer and rare diseases.","Deloitte, DNAstack, Genome BC, LifeLabs, Molecular You, UBC, Microsoft",General,1.4,3.42,03/02/2019,"Vancouver, BC"
Digital Technology Cluster,"Maritime Emergency Response Systems This pilot project will develop an AI powered emergency preparedness and response system, enhancing real-time data integration, analytics, and coordination. The scalable solution holds commercial potential for adoption by emergency services and maritime industries, improving safety and resilience in ocean-related activities.","B-Side Group Consulting, ResolveHD, Canadian Emergency Services Collaborative Innovation Lab (CESCIL)",General,0.73,1.46,06/10/2025,"Halifax, NS"
Digital Technology Cluster,"Enhancing Aquaculture Productivity with Environmental Genomics This project will leverage environmental genomics technologies to address critical challenges faced by the salmon aquaculture industry, including environmental stewardship, as well as enhancing disease detection and mitigation efforts.","eDNAtec Inc., Mowi Canada West",General,0.93,2.94,06/10/2025,"Campbell River, BC"
