Digital Technology Cluster,"Development of Miniaturized Piezocomposite Sonar Transducer This project will develop a customizable solution to improve the quality of the images and scans from inspections of underwater assets in remote locations, using miniaturized piezocomposite sonar transducers, which will allow end users to make quicker and more reliable decisions. This made in Canada solution will create new domestic and export opportunities, skilled jobs and supply chain opportunities.","Sensor Technology Ltd., NorthEastern Micro, Kraken Robotics",General,0.57,0.91,12/17/2020,"Dartmouth, NS"
Digital Technology Cluster,"Ocean Energy Smart Grid Integration Project This project will enable the cost-effective integration of Ocean Energy Generators (OEG) into communities. Many remote coastal communities are not connected to national electrical grids, and the cost of integrating new green energy generation alternatives is high due to the need for customization. This project standardizes the smart grid through the 'Microgrid Interface Unit' (MIU). This will result in reduced dependency on diesel generators in rural communities and increase the opportunity for renewable sources of energy.","BMT Canada, Sustainable Marine Energy",General,0.63,0.98,12/17/2020,"Ottawa, ON"
Digital Technology Cluster,"Digital Ship In-Service Support System This project combines on-board vessel sensor and digital twin technologies for vessel management and maintenance through an advanced technology platform. This new platform will help vessel designers, builders, operators and maintainers more efficiently manage vessel lifecycle; reduce down-time for repair and maintenance by providing predictive information; improve vessel design and construction to reduce costs; and integrate multiple data sources by leveraging the language of visualization. It will help make Canada more globally competitive, drive export opportunities, and create jobs in the marine sector.","Seaspan Shipyards, Genoa Design",General,2,3.08,12/14/2020,"North Vancouver, BC"
Digital Technology Cluster,"Digital IoT This project supports collaborative R&D that will result in an Internet of Things (IoT) enabled solution providing remote monitoring as a Managed Service. The project will enhance Canada's competitive position on the international stage in radar system data acquisition and cloud-based storage & analytics. It will also enable data collection that will enhance further collaboration with academic, government and other industrial partners.","Rutter Inc., Husky Energy, Government of Newfoundland and Labrador, NRC-IRAP",General,0.72,3.17,12/10/2020,"St. John's, NL"
Digital Technology Cluster,"Blue Futures Pathways This ecosystem-building project will connect youth across Canada with education and employment, and support participants in developing a successful career in the sustainable blue economy. The initiative is supportive of all youth aged 18-30 and will have a particular focus on the inclusion and inspiration of under-represented, remotely located, and Indigenous people.","Students on Ice Foundation, Centre for Ocean Venture Entrepreneurship (COVE), ECO Canada, Mitacs",General,1.49,2.41,11/25/2020,"Gatineau, QC"
Digital Technology Cluster,"CARIS Cloud Technology This project will develop and utilize highly specialized software in the Cloud that will reduce the need for operators in the field, and enable increased processing and quality control from an office or home setting. The techbology developed through this project will bring efficiencies, cost savings and reduce human risk particularly for higher risk, high priority areas where measurements are currently conducted using regular field surveys.","Teledyne CARIS, Ocean Floor Geophysics, Marine Institute, UNB - Ocean Mapping Group (OMG), Interdisciplinary Development Centre for Ocean Mapping (CIDCO), Hydrospatial International Inc. (H2i)",General,0.94,2.13,11/20/2020,"Fredericton, NB"
Digital Technology Cluster,"Smart Protective Coatings This project will develop and commercialize new graphene-based protective coating products for vessels. These coatings provide a number of advantages to marine industries including reduced fuel consumption for vessels, non-toxic protection, and reduced underwater radiant noise. The products will not only help position Canada as a global hub of ocean innovation, but also deliver shared competitive advantages in accessing those world-wide market opportunities across different ocean sectors - particularly with its environmental focus.","Graphite Innovation Technologies (GIT), Horizon Maritime Services Ltd., Netukulimk Fisheries Limited (NFL), Mitacs",General,2.24,4.65,11/19/2020,"Halifax, NS"
Digital Technology Cluster,"Ocean Allies This innovation ecosystem project will foster a more diverse, inclusive, and equitable space in the ocean economy for untapped communities, through partnerships with key ocean sector organizations and targeted strategic activities.","Pisces Research Project Management, Upswing Consulting Solutions, Huntsman Marine Centre, Assembly of First Nations, BioNB, Center for Ocean Ventures and Entrepreneurship (COVE), Irving Shipbuilding, Nova Scotia Business Inc. (NSBI), Ocean Technology Council of Nova Scotia (OTCNS), Ocean Advance, PanGeo Subsea, Synapse PEI, Mitacs",General,0.25,0.42,11/19/2020,Pan-Canadian
Digital Technology Cluster,"Vitality This innovation ecosystem project will leverage Canada's ocean data to deliver definitive commercial outcomes to the businesses involved by advancing ocean data analysis, management and visualization capabilities, and products.","Pisces Research Project Management, Dalhousie University, Perennia Food and Agriculture Inc., Fundy Ocean Research Centre for Energy (FORCE), University of Victoria, St-Lawrence Global Observatory (SLGO), Tula Foundation, Marine Renewables Canada (MRC), COIN Atlantic",General,1.5,3.8,11/19/2020,Multiple Locations
Digital Technology Cluster,"XO-G2 Marine industries are seeking safer, lower cost, unmanned solutions for collecting ocean data. This project will develop the next generation of Unmanned Surface Vessel (USV) that addresses these challenges and expands existing capabilities to survey faster, deeper, further offshore with negligible carbon emissions.","XOcean Canada Ltd., XOcean Ltd., ABCO Industries, DMR Boat Design, Ocean Floor Geophysics, Department of Oceans and Fisheries",General,2,3.36,11/19/2020,"Dartmouth, NS"
Digital Technology Cluster,"Marine Search and Rescue Simulation This project will deliver a new device and capability to train search and rescue (SAR) operators under realistic mission scenarios including turbulent flow zones, sea state, complex ship and offshore installation geometries and rescue rafts, while simulating the full array of harsh East coast and arctic environmental conditions.","Bluedrop Learning Networks, Cougar Helicopters Inc., Memorial University of Newfoundland",General,1.03,2.06,11/13/2020,"Halifax, NS"
Digital Technology Cluster,"CoLab Enterprise - 3D Engineering Review, Communication & Collaboration Hub This project aims to build and commercialize a highly configurable, enterprise-ready communication platform that supports the future of Agile Model-Based Enterprises and Digital Twin Solutions. This new platform will contribute to Canada's competitive advantage in the management of complex engineering projects, using a cloud-based solution that combines 3D design review technology and mechanical issue tracking to securely support thousands of users working together in real-time.","CoLab Software Inc., Genoa Design, Kraken Robotics, PRNL",General,1.63,2.8,11/13/2020,"St. John's, NL"
Digital Technology Cluster,Building an Inclusive Workforce for Innovative Arctic Ocean Technology This ecosystem-building projectseeks to provide technical skills training for Inuit participants across Inuit Nunangat. The holistic and culturally contextualized training curriculum will address the barriers faced by Inuit in remote northern communities and promote their inclusion and participation in the ocean economy.,"SmartICE Sea-Ice Monitoring & Information Inc., Pinnguaq Association, Nunavut Fisheries Association, Ilitaqsiniq Literacy Council, Social Research and Demonstration Corporation",General,1.15,1.79,11/13/2020,"St. John's, NL"
Digital Technology Cluster,"Ocean DNA System Project partners will work in collaboration to revolutionize the development and commercialization of genomics solutions in order to modernize the way we monitor, measure and assess fish stocks and characterize the ocean.","eDNAtec, Petroleum Research Newfoundland and Labrador (PRNL), Nunavut Fisheries Association, Department of Fisheries and Oceans (DFO)",General,2.21,4.91,09/24/2020,"St. John's, NL"
Digital Technology Cluster,Indigenous Career Pivot Pilot This pilot program aims to facilitate and support meaningful work placements for Indigenous peoples wishing to explore career options in the ocean economy. The project will support the employment of approximately 10 Indigenous peoples in Ocean Cluster member organizations for 12-month placements. Participants will gain valuable experience in a new industry and will enhance their knowledge through placements that complement their existing skillset and natural aptitudes.,"Ulnooweg Development Group, JEDI, College of the North Atlantic",General,0.55,0.74,09/21/2020,"Truro, NS"
Digital Technology Cluster,Ocean Aware This project will develop next-generation underwater observation systems for deployment in zones of high commercial interest to enable both Canadian and global ocean industries to balance business efficiency and profitability with sustainable ocean business practices. The technologies and information-sharing concepts developed will improve monitoring capabilities over wide areas of ocean and will allow such monitoring to be done more economically and more quickly.,"Innovasea, Emera, Xeos Technologies, Dartmouth Ocean Technologies, Ocean Choice International, DFO, The Ocean Tracking Network, Irving Shipbuilding, Dalhousie University, Memorial University of Newfoundland",General,13.72,42.89,07/28/2020,"Bedford, NS"
Digital Technology Cluster,"Ocean Startup Through this project, partners will be supporting the development of ocean technology start-ups and increasing the industrial use of marine technologies. This innovative project will address talent challenges by growing the ocean workforce, helping new businesses hire employees with the skill sets they need. In addition, the project will encourage the participation of under-represented groups such as women and Indigenous groups in this vital economic sector.","The Genesis Centre, Innovacorp, PEI Bioalliance, New Brunswick Innovation Foundation, Dalhousie University, Springboard Atlantic, Mitacs, ACOA, (Provincial Governments)",General,4.08,7.1,02/21/2020,Multiple Locations
Digital Technology Cluster,"OceanVision These project partners will develop a turnkey service solution for the collection of seafloor imaging and mapping to be used by a number of ocean industries, including oil and gas, fishing, hydrographic, search and salvage, and military and defence. This new underwater service hub uses new marine technologies and products to produce high-resolution images of the seafloor, and will reduce the cost and risk of operating in ocean environments.","Kraken Robotics, Petroleum Research Newfoundland & Labrador, Ocean Choice International, Nunavut Fisheries Association, NRC, Government of Newfoundland",General,6.26,18.78,06/28/2019,Multiple Locations
Digital Technology Cluster,"Enhancing genomics in Canadian soybeans This project aims to establish a breeding program for non-GMO soybeans. The program will focus on breeding for competitive yield, SCN tolerance, and maturity to minimize the yield gap with GMO soybeans.","NRGene, Hensall Co-op, Yumasoy Foods Ltd., Pulse Genetics",General,1.89,4.28,06/23/2025,"Saskatoon, SK"
Digital Technology Cluster,"AI-Enhanced Grain Quality for Sustainable Agriculture This project will develop a solution that integrates advanced artificial intelligence and image processing technologies to provide accurate, real-time grain quality assessments using standard smartphone cameras.","Grain Discovery, Inarix, Sevita International",PCAIS,0.63,1.39,06/05/2025,"Picton, ON"
Digital Technology Cluster,"Investing in Canada's Oat protein future This project aims to develop and scale oat fractionation technology, which will contribute to the creation of a protein ingredient used in consumer packaged goods (CPG) products.","One Degree Organics, Vibrant Health, No Meat Factory, Tuft and Paw",General,12.2,4.99,05/29/2025,"Mission, BC"
Digital Technology Cluster,"Shooting for the Stars: Aiming for Burger Perfection The project will focus on developing a plant-based burger that mimics the taste, texture, and mouthfeel of traditional beef burgers.","LovinglyMade Flour Mills, Botaneco",General,0.24,0.53,05/15/2025,"Saskatoon, SK"
Digital Technology Cluster,"Lupin Loop This project aims to help develop an export market for a new lupin variety by testing its agronomy traits, functionality in ingredients and application into North American and European food product.",Lupin Platform,General,0.32,0.71,04/17/2025,"Calgary, AB"
Digital Technology Cluster,"Project Loop This project aims to bring more sustainable high-protein food options into grocery stores and to consumers. Project partners will develop faba protein and extruded ingredients, and from them, create high-protein consumer packaged goods. The consortium will also help scale up and improve current processing methods to support commercialization of the ingredient, including through the employment of a learning and information-sharing approach across the value chain.","Griffith Foods, Faba Canada, Botaniline, BFY Proteins",General,2.74,7.77,12/04/2024,"Toronto, ON"
Digital Technology Cluster,"Canadian Pilot Scale Processing of High Value Powdered Soymilk Ingredients for North American and Japanese Markets The project aims to build a pilot scale facility to provide further validation of the soymilk powder process developed in a previous project, as well as to build operational capacity to produce the soymilk powder to specification and at scale, in order to complete market assessments.","Alinova Canada, Marusam-AI, Earth's Own Foods, Flamaglo Foods",General,6.7,23.9,11/27/2024,"Inkerman, ON"
Digital Technology Cluster,"AI-Enhanced Agrifood Value Chain: From Precision Ag Production to Food Ingredient Processor Sustainability This project will be using artificial intelligence (AI) to improve crop production management and sustainability. By enhancing the precision of agricultural practices and increasing the adoption of technologies optimizing input efficiency, this project will reduce agricultural emissions and pesticide use, and establish reliable measurement, reporting, and verification (MRV) models to ensure transparency and traceability throughout the supply chain.","Croptimistic Technology, TheoryMesh, C-Merak",PCAIS,2.44,5.41,11/27/2024,"Saskatoon, SK"
Digital Technology Cluster,"Integration of animal-free collagen to enhance plant-based foods & pet nutrition This project is leveraging soluble, gellable collagen technology to enhance plant-based meat analogues and pet nutrition. This consortium aims to enhance the texture and nutritional profile of plant-based meat analogues, incorporate collagen in plant-based pet nutrition products and optimize processes to ensure cost effectiveness of collagen ingredients.","Liven Proteins, ALT-PRO",General,0.85,1.89,11/12/2024,"Toronto, ON"
Digital Technology Cluster,"Building a more nutritious future with Canadian proteins This project aims to improve the nutrition, flavour and texture of plant-based products through research. Partners also plan to scale the use of plant-based proteins in savoury, sweet, and shell pastry products.","Tartistes, Wamame Foods",General,1.43,5.98,11/12/2024,"Burnaby, BC"
Digital Technology Cluster,"Improving Plant-based Cheese Options This project will develop a new line of plant-based cheeses using pulses that aim to overcome the flavor, nutritional, and textural challenges of existing plant-based cheese products.","Daiya Foods, Ingredion Inc., Ingredion Plant Based Protein Specialties Inc., Lovingly Made Flour Mills",General,12.6,4.22,10/17/2024,"Burnaby, BC"
Digital Technology Cluster,In-Field Quality Insight for the Supply Chain This project will leverage AI to increase transparency in the food value chain by developing technology to predict and assess protein crops in the field during growing season and harvest.,"Ground Truth Agriculture, Parametrics.Ag, C-Merak Innovations, Cas-Grain Farms",PCAIS,2.02,4.49,07/11/2024,"Regina, SK"
Digital Technology Cluster,Advancing Sustainable Protein Solutions This project will advance the commercialization of extrusion technology and help bring new food and ingredients from pea and fava beans to consumers.,"Lovingly Made Flour Mills, TMRW Foods, Dutton Farms",General,3.28,7.68,06/25/2024,"Saskatoon, SK"
Digital Technology Cluster,"Low Cost and Sustainable Dry Fractionation of Hemp and Canola This project will validate and use large scale CO2 extraction technologies to create new high-quality protein and flour products from hemp and canola, including protein concentrate and gluten-free flour. Blue Sky also hopes to refine and commercialize food-grade oil or lecithin from secondary oil recovered from canola meal.","Blue Sky Hemp Ventures, THAR Processing, Virtex Grain Exchange",General,1.68,5.96,05/29/2024,"Saskatoon, SK"
Digital Technology Cluster,"Expanding the Canadian Lupin Ecosystem from Farm to Fork This project will conduct work to support the growth and widespread adoption of lupin crops in Canada, as well as a range of activities that contribute to the development, scale-up and improvement of consumer packaged goods and ingredients, including plant-based egg and dairy products, lupin flour and bakery mixes.",Deloitte Inc.,General,3.67,8.66,05/23/2024,"Calgary, AB"
Digital Technology Cluster,"Early detection of herbicide resistant weeds in protein crops using AI The project will create a novel AI-powered system to measure the efficacy of herbicides applied to plant protein crops to predict and control herbicide resistances. This system will analyse post-application fields on a plant-by-plant basis and identify specific resistance candidates very early, mapping them out over the field and enabling a precision application of additional herbicide to just those plants in order to control and prevent the proliferation of resistant weeds.","Precision.ai, Global Institute for Food Security (GIFS), GECO Enterprises Ltd, SureGrowth Solutions Ltd",PCAIS,2.77,6.16,05/15/2024,"Regina, SK"
Digital Technology Cluster,"Technology Development and Commercialization of New Pulse Protein This project aims to develop new technology and commercialization for pulse proteins, including fava and beans.","Roquette Canada, Prairie Fava, Plant Up, BioNeutra North America",General,10.75,24.52,05/07/2024,"Portage la Prairie, MB"
Digital Technology Cluster,"Accelerating the Use of Plant-based Protein Isolates This project will source, package, and scale a new reformulated ingredient blend for use in plant-based protein (PBP) consumer-ready products, including modular, ready-to-mix, and ready-to-drink low-volume liquid protein. Project partners will also be building on the success of a previous cluster-funded project to further commercialize and improve consumer-ready products within current and new markets.","Enhanced Medical Nutrition Inc., Acenzia Inc., Gruppo Nutrition Inc.",General,2.35,5.46,04/30/2024,"Toronto, ON"
Digital Technology Cluster,"Fueling Canada's Premium Functional Plant-Protein Sector This project will invest in new food technologies and products using local ingredients, while also developing, commercializing, and scaling a diverse range of products featuring sustainable Canadian proteins.","Wamame Foods Inc., AGT Foods and Ingredients Inc, Crush Dynamics Inc, Apex FoodSource Ltd",General,2.79,6.26,04/15/2024,"Vancouver, BC"
Digital Technology Cluster,"Hybrid Hemp Innovation Value Chain This project will bring together industry leaders to create an innovation value chain that develops hybrid hemp cultivars that meet both the physical and functional traits valued by processors, food ingredient companies, and consumers. This innovation value chain will also create an a system where functional and processing characteristics can be accessed, inputted, and provided feedback on, which will support future innovation in breeding high yielding hemp hybrids that both improve processing efficiency and meet consumer demands for taste and nutrition.","Verve Seed Solutions, Fresh Hemp Foods, Farmers Business Network Canada",General,2.56,5.72,04/04/2024,"Saskatoon, SK"
Digital Technology Cluster,"Creation of High Protein Canola, Utilization of High Protein Canola & Sunflower Building on their successes in two cluster-funded projects, project partners will be working together to further the commercialization, market development, and value realization of high-protein canola, sunflower protein, and novel oilbody products.","Corteva Agriscience, Botaneco, Bunge, Rainfed Foods, Northeast Nutrition",General,13.38,31.02,03/27/2024,"Calgary, AB"
Digital Technology Cluster,"Production and Commercialization of Sunflower and Hempseed Protein Isolates The consortium will develop a new line of hemp and sunflower protein ingredients through this project. By adding value to existing, lower-value products, this project will help secure domestic and international supply chains and support Canada's economic growth.","Burcon, HPS Food & Ingredients, Puratos",General,3.06,6.92,03/12/2024,"Winnipeg, MB"
Digital Technology Cluster,"Advancing the Canadian Fava Ecosystem by Empowering Value-Chain Stakeholders Prairie Fava will be working with partners to strengthen the supply of fava beans in the food and ingredients markets, providing consumers with an increased selection of healthy and sustainable food options.","Prairie Fava, Three Farmers, DL Seeds",General,5.4,13.2,03/06/2024,"Glenboro, MB"
Digital Technology Cluster,"Innovating Pulse and Oat Milled Products to Meet Customers' Requirements for Healthy, Functional, and Sustainable Plant-Based Ingredients This project will incorporate more oats and pulses into food and beverages, such as yogurt, veggie-links, and pastries, to expand the selection of healthy food products to better meet consumer expectations.","Avena Foods, Big Mountain Foods, Danone, Old Dutch",General,7.36,19.23,02/26/2024,"Regina, SK"
Digital Technology Cluster,"Pulse and Grain Protein Fortification and New Product Development in Plant-Based Seafood Products This project will amplify the nutritional content of Konscious Foods' existing line of plant-based seafood products while also developing new products, including nori and tamagoyaki egg products.","Konscious Foods Canada Inc, Canadian Pacifico Seaweeds Ltd., Avena Foods",General,2.29,5.11,02/07/2024,"Richmond, BC"
Digital Technology Cluster,"Development of AI/ML based models for predicting the presence anthracnose and/or ascochyta blight and grain moisture content for lentil crop (PCAIS Project) Ukko Agro, Hawk's Agro, and Three Farmers are leveraging AI to help farmers better predict the early presence of anthrocnose and asochyta diseases in lentil crops as well as in-season grain moisture content, enabling more sustainable application of remedies to support crop health and maximize yields.","Ukko Agro Inc., Hawk's Agro Ltd., Three Farmers Inc.",PCAIS,1.19,2.64,12/06/2023,"Toronto, ON"
Digital Technology Cluster,"Pilot Demonstration, Optimization and Scale Up of Plant-based Salmon This project is a follow-on to New School's first project, where they successfully worked with Liven to prove out the technology necessary to formulate a full, muscle-cut type product. This project builds on the success of that project to focus on scaling up production and the sale of a fully commercial, market-ready product. This product brings improved technology and better processing, ultimately leading to a premier, commercially available product.","New School Foods Inc., Liven Protein Corp., Nuwave Research Inc.",General,4.65,11.48,11/15/2023,"Toronto, ON"
Digital Technology Cluster,"AI-driven Crop Sentry Device for Real-Time Autonomous 3D Crop Measurement (PCAIS Project) This project contributes to several important desired outcomes, including accelerated innovation with respect to producing plant-based ingredients and food of the future. Specifically, this includes fast-track variety development and product formulation to help Canadian firms create new products faster, and consistent with market expectations of plant-based foods, which includes a focus on quality.","Enns Brothers Ltd., Crop Sentry Ltd., DL Seeds Inc., AGT Food and Ingredients",PCAIS,5.88,13.06,11/01/2023,"Winnipeg, MB"
Digital Technology Cluster,"An Indigenous Strategy for Re-energizing Traditional Wild Rice, Creating a Plant Protein Industry for the Prairies This project aims to create a consistent cultivated wild rice supply chain within Indigenous communities by identifying the best prairie-growing wild rice varieties with higher protein content, conducting assessments on which ones are a viable economic fit for Indigenous communities to grow, and training Indigenous communities to grow wild rice. The crops will also be commercialized through partners and undergo recipe development and testing to determine the use of wild rice within Indigenous foods.","Myera, Southeast Resource Development Center, Louis Riel Capital Corporation/MMEF, R&L Acres, Urmatt, Future Food Systems, MITACS",General,3.65,10.72,12/20/2022,"St. Francois Xavier, MB"
