Advanced Manufacturing Cluster,3D Printing and Semi-Automation of Advanced Manufacturing Processes for Patient-Specific Pessaries,"Cosm Medical, Agile Manufacturing",General,0.25,0.5,02/14/2023,"Toronto, ON"
Advanced Manufacturing Cluster,Development of Gas Oscillation System for Superplastic Forming Process,"AEM Power Systems, Additive Metal Manufacturing, Macrodyne Technologies",General,0.25,0.5,02/14/2023,"Windsor, ON"
Advanced Manufacturing Cluster,The Development of a Robotic Solution for Building Component Prefabrication,"ACQBuilt, Promise Robotics",General,0.24,0.54,02/14/2023,"Edmonton, AB"
Advanced Manufacturing Cluster,Advanced recycling technologies for single-use PPE,"MEA Health, MLD Solutions",General,0.25,0.5,02/14/2023,"Kitchener, ON"
Advanced Manufacturing Cluster,Advanced Manufacturing of integrated quantum dot lasers on silicon photonics,"Luxmux Technology, Dream Photonics",General,0.25,0.55,02/14/2023,"Calgary, AB"
Advanced Manufacturing Cluster,"Online monitoring, diagnostics and predictive analytics of critical assets in food & beverage use-case","Enertics, Skjodt-Barrett Foods",General,0.25,0.5,02/14/2023,"Brampton, ON"
Advanced Manufacturing Cluster,"Development of system for automated calibration & testing of 100% electric sidewalk robots, & moving the manufacturing of robots to Ontario","TopHat, Clear Software Inc., Demtool Inc.",General,0.25,0.5,02/14/2023,"Kitchener, ON"
Advanced Manufacturing Cluster,Towards a Canadian Circular Economy: Novel Manufacturing Processes for Iron-based Coagulants from Metal Wastes for Environmental Applications,"USP Technologies Canada, Municipality of Middlesex Centre, Ryerson University",General,0.1,0.23,02/14/2023,"London, ON"
Advanced Manufacturing Cluster,Characterization of the Dimensionality of Two-Dimensional Nanomaterials,"Lantern Machinery Analytics, Zentek",General,0.1,0.2,02/14/2023,"Vancouver, BC"
Advanced Manufacturing Cluster,Feasibility Study of Manufacturing of Enersion's Tri-Generation,"Enersion, Impact Centre",General,0.1,0.26,02/14/2023,"Toronto, ON"
Advanced Manufacturing Cluster,Production and recycling of nickel materials for EV batteries via carbonyl technology,"Weber Manufacturing Technologies, VPM Research",General,0.25,0.5,02/14/2023,"Midland, ON"
Advanced Manufacturing Cluster,First Canadian Graphene Commercial Supply Chain,"Ora Graphene Audio, LOCUS Precision",General,0.25,0.5,02/14/2023,"Montreal, QC"
Advanced Manufacturing Cluster,Weston Predictive Maintenance Pilot,"Smart Skin Technologies, Coca-Cola Bottling Limited Canada",General,0.08,0.23,02/14/2023,"Fredericton, NB"
Advanced Manufacturing Cluster,Air Cathode Pilot Production Line,"e-Zn, Macrodyne Technologies",General,0.25,0.5,02/14/2023,"Toronto, ON"
Advanced Manufacturing Cluster,Solid State Lithium Batteries,"Electrovaya, Process Research Ortech",General,0.22,0.5,02/14/2023,"Mississauga, ON"
Advanced Manufacturing Cluster,Deployment of an Augmented Reality Remote In-Process Inspection Solution in Discrete Manufacturing,"Interaptix, Gastops",General,0.08,0.17,02/14/2023,"Ottawa, ON"
Advanced Manufacturing Cluster,Innovative Process to Produce Marine Coating,"Graphite Innovation Technologies, K&D Pratt",General,0.25,0.5,02/14/2023,"Dartmouth, NS"
Advanced Manufacturing Cluster,Low-cost Machine Vision: slashing cloud computing costs by 16x using the Distributive Compute Protocol,"Distributive Corp, Honey Vision Inc.",General,0.1,0.2,10/11/2022,"Kingston, ON"
Advanced Manufacturing Cluster,Global Leadership in Life Sciences by Enabling Commercial Scale Manufacture of Cell & Gene Therapies,"OmniaBio Inc. (New CDMO spin-off from CFRM Enterprises), Aspect Biosystems Ltd., Canadian Advanced Therapies Training Institute, ExCellThera Inc., Morphocell Technologies Inc.",General,10.54,34.82,09/20/2022,"Hamilton, ON"
Advanced Manufacturing Cluster,Development of bacterial frameworks for biomanufacturing of industrial and therapeutic products,"Mediphage Bioceuticals Inc., Ardra Inc.",General,0.24,0.57,09/15/2022,"Toronto, ON"
Advanced Manufacturing Cluster,Bioplastic as an alternative to single-use plastics,"Macrodyne Technologies Inc., Ridgetech Automation, Linear Transfer Automation Inc.",General,3.55,8,08/16/2022,"Vaughan, ON"
Advanced Manufacturing Cluster,Robotic Mass Timber CNC Processing Center,"Intelligent City Inc., Brave Control Solutions",General,0.88,1.99,07/11/2022,"Vancouver, BC"
Advanced Manufacturing Cluster,Scaling up the manufacturing process for BrainPrint Bioink,"Axolotl Biosciences, Starfish Medical",General,0.16,0.41,07/08/2022,"Victoria, BC"
Advanced Manufacturing Cluster,Indigenous Manufacturing and Constructing Network - Saskatchewan (IMCN-Sask),Xtended Hydraulics & Machine Inc.,General,0.08,0.15,06/23/2022,"Saskatoon, SK"
Advanced Manufacturing Cluster,Micro-Power-Plant Advanced Manufacturing Demonstrator,"McGuire Aero Propulsion Solutions, Burloak Technologies",General,2.24,5.67,06/22/2022,"Toronto, ON"
Advanced Manufacturing Cluster,National Bio-Manufacturing Centre,"Verschuren Centre Inc., deNova Inc.",General,2.41,8.43,06/09/2022,"Sydney, NS"
Advanced Manufacturing Cluster,"Development of large-scale additive manufacturing capabilities for next-generation, eco-friendly hybrid rocket engines","Reaction Dynamics Lab, Amrikart Ressource Cybernetique",General,1.51,4.89,06/01/2022,"Montreal, QC"
Advanced Manufacturing Cluster,Industrial Implementation of CarbiCrete's Carbon-Negative Concrete Manufacturing Process at Patio Drummond,"CarbiCrete Inc., Patio Drummond, Innovative Inc.",General,3.44,7.74,05/26/2022,"Lachine, QC"
Advanced Manufacturing Cluster,Data Acquisition and Visualization Platform for the Manufacturing of Carbon-Negative Concrete,"CarbiCrete Inc., Patio Drummond",General,0.25,0.5,05/26/2022,"Lachine, QC"
Advanced Manufacturing Cluster,New and Innovative End-of-Line Tester,"Kepstrum Inc., Stackpole International Engineered Products, Armo-Tool Limited",General,0.25,0.5,05/09/2022,"Vaughan, ON"
Advanced Manufacturing Cluster,Intelligent Pilot Manufacturing Line for the Thermal Ground Plane (TGP) T-Man,"Calogy Solutions, Linear Automation",General,1.31,2.62,04/29/2022,"Sherbrooke, QC"
Advanced Manufacturing Cluster,Manufacturing denaLi C Green Lithium Extraction Modules,"Summit Nanotech, Ionic Solutions",General,3.97,7.94,04/29/2022,"Calgary, AB"
Advanced Manufacturing Cluster,Advanced Manufacturing Methods for Electric Vehicle Propulsion Batteries,"Ventra Group, Inspetech",General,3.6,7.2,04/29/2022,"Windsor, ON"
Advanced Manufacturing Cluster,Next Generation Gradfoil Plat Forming Pilot Line,"Ballard Power Systems, Macrodyne Technologies, Eclipse Automation",General,3.18,6.37,04/29/2022,"Burnaby, BC"
Advanced Manufacturing Cluster,Green Recycling of EV Battery Black Mass,"Cnem, Talon Metals Services, Palcan Energy",General,0.41,0.91,04/29/2022,"Mississauga, ON"
Advanced Manufacturing Cluster,AI-Assisted Smart-Optic Manufacturing of Modular EV Systems,"Damon Motors, DarwinAI, Moment Energy",General,3.98,7.96,04/29/2022,"Vancouver, BC"
Advanced Manufacturing Cluster,Automated Module Assembly with Advanced Laser Welding and In-Line QC Methods,"Electrovaya, EECOMOBILITY",General,1.21,2.48,04/29/2022,"Mississauga, ON"
Advanced Manufacturing Cluster,Establish CoE for HVM of HFCs for HDCV to realize Canada's GHG emissions target by 2030 & 2050,"Hydrogenics, AIS, Konnexio,Shelley Industrial Automation",General,3.67,7.77,04/29/2022,"Mississauga, ON"
Advanced Manufacturing Cluster,Compact Inverter Manufacturing Development,"Linamar, Westhill Innovation",General,3.48,7.02,04/29/2022,"Guelph, ON"
Advanced Manufacturing Cluster,Development of Next Generation Membrane Electrode Assembly Using Novel Nanoporous Carbon Materials for High Performance Polymer Electrolyte Membrane Fuel Cell,"Momentum Materials Solutions, BlissEarth Energy Research",General,0.43,0.95,04/29/2022,"Calgary, AB"
Advanced Manufacturing Cluster,Scale-up to Commercialization of Metallic Bipolar Plates for Fuel Cell Road Vehicles using Advanced Manufacturing in Canada,"Precision Resource Canada, Miltera Machining Research",General,3.99,7.99,04/29/2022,"Cambridge, ON"
Advanced Manufacturing Cluster,Development of scalable manufacturing processes for solar film integrated body panels,"Rayleigh Solar Tech, Magna International",General,0.4,0.81,04/29/2022,"Halifax, NS"
Advanced Manufacturing Cluster,Recycling of Solid-State Lithium metal Batteries for EV Powertrains,"Li-Metal, Blue Solutions Canada",General,2.36,5.06,04/29/2022,"Markham, ON"
Advanced Manufacturing Cluster,Flex-Ion Advanced Battery Innovation Center -- Advanced Manufacturing Research (Project Tau),"Ventra Group, ECAMION",General,3.55,9.67,04/29/2022,"Windsor, ON"
Advanced Manufacturing Cluster,Next Generation NMP-free Cell Manufacturing,"Electrovaya, Lantern Machinery Analystics, EECOMOBILITY",General,0.93,1.87,04/29/2022,"Mississauga, ON"
Advanced Manufacturing Cluster,Vector Mass Production Metal 3D Printing System,"Mosaic Manufacturing Ltd., Dyze Design Inc., Matter And Form Inc., McMaster University, Queen's University",General,3.55,8,01/26/2022,"Toronto, ON"
Advanced Manufacturing Cluster,Driving Advanced Manufacturing Practices Through Supply Chain Resilience Analytics,"ThinkData Works, Palantir Technologies, Martinrea International",General,3.55,8,01/18/2022,"Toronto, ON"
Advanced Manufacturing Cluster,Development and Industrial Demonstration of Metal Casting Digital Twin with Integrated AI-Driven Optimization,"Cast Analytics Inc., Empower Operations Corp., Applied CCM, Inc.",General,0.1,0.24,12/09/2021,"Vancouver, BC"
Advanced Manufacturing Cluster,Bio-refinery Engineering Study,"Advanced BioCarbon 3D Ltd., KF Hemp Corp.",General,0.1,0.2,12/09/2021,"Trail, BC"
Advanced Manufacturing Cluster,3D BioFibR Advanced Biofiber Manufacturing,"3D BioFibR Inc., Dalhousie University",General,0.07,0.21,12/09/2021,"Halifax, NS"
Advanced Manufacturing Cluster,Transformation of the Stone Veneer Panel Manufacturing and Installation Process,"Apex Industries Product Development & Automation Group Inc., 709960 NB Ltd.",General,0.1,0.2,12/09/2021,"Moncton, NB"
Advanced Manufacturing Cluster,Novel Clean Tech. Manufacturing Process for the Catalytic Production of a Green Disinfectant for Water Treatment,"Datec Coating Corporation, Process Research Ortech Inc",General,0.08,0.2,12/09/2021,"Mississauga, ON"
Advanced Manufacturing Cluster,Deep Cryogenic treatment tank for industrial applications,"Deep Cryogenics International Inc., Induspec",General,0.23,0.45,12/09/2021,"Dartmouth, NS"
Advanced Manufacturing Cluster,Automated Slitter Table Technology with Weight Compensation,"Macrodyne Technologies Inc., Ridgetech Automation",General,0.13,0.25,12/09/2021,"Concord, ON"
Advanced Manufacturing Cluster,Development and implementation of an autonomous novel bottle/pump insertion solution,"Petra Hygienic Systems International Limited, Sidac Automated Systems Inc.",General,0.25,0.74,12/09/2021,"Concord, ON"
Advanced Manufacturing Cluster,Low latency tele-robotics for manufacturing pick and place,"Quali Artificial Intelligence Inc., Novo Textile",General,0.1,0.2,12/09/2021,"Kitchener, ON"
Advanced Manufacturing Cluster,Manufacturing Process for Magnetic Resonance Imaging (MRI) Gradient Coil Production,"Synaptive Medical Inc., MRIdt Inc.",General,0.24,0.8,12/09/2021,"Toronto, ON"
Advanced Manufacturing Cluster,High speed temperature measurement for aluminum strip processing,"Hazelett CASTechnology ULC, Aluminum Valley Society",General,0.25,0.5,12/09/2021,"Calgary, AB"
Advanced Manufacturing Cluster,Asphaltene Carbon Fiber Feasibility Study,"Exergy Solutions Inc., Suncor Energy Oils Sands Limited, Archer BD Inc.",General,0.08,0.17,12/09/2021,"Calgary, AB"
Advanced Manufacturing Cluster,Pilot Scale Bio refinery - Replacing petrochemical plastics with 100% bio based materials that perform as well,"Advanced BioCarbon 3D Ltd, KF Hemp, Virtual Layer",General,0.25,0.5,12/09/2021,"Trail, BC"
Advanced Manufacturing Cluster,Delivering a Transformative Industry 4.0 Capability Enhancement for the East Coast Battery Materials Development & Manufacturing Sector,"Novonix Battery, Well Engineered Incorporated",General,1.68,17.75,12/07/2021,"Bedford, NS"
Advanced Manufacturing Cluster,Scale-up of graphene based membrane manufacturing,"Evercloak, Environmental Systems Corp.",General,2.03,4.57,08/13/2021,"Waterloo, ON"
Advanced Manufacturing Cluster,AscendBio,Verschuren Centre,General,0.08,0.15,07/29/2021,"Sydney, NS"
Advanced Manufacturing Cluster,OAC Virtual Aerospace Matchmaking Platform and Intelligence Hub,Ontario Aerospace Council,General,0.08,0.46,07/29/2021,"Pickering, ON"
Advanced Manufacturing Cluster,Canadian Nanomedicine Cluster,"NanoCanada, CMC Microsystems",General,0.08,0.16,07/29/2021,"Edmonton, AB"
Advanced Manufacturing Cluster,Manufacturing & Export Enhancement Cluster (MEE),Central Alberta Access Prosperity,General,0.08,0.21,07/29/2021,"Red Deer, AB"
Advanced Manufacturing Cluster,Virtual Photon Cluster,Canadian Photonic Industry Consortium Inc.,General,0.03,0.06,07/29/2021,"Quebec City, QC"
Advanced Manufacturing Cluster,CAMM Transformation Virtual Program,Canadian Association of Moldmakers Inc.,General,0.08,0.16,07/29/2021,"Windsor, ON"
Advanced Manufacturing Cluster,Aerospace & Automotive Advanced Air Mobility Manufacturing,Canadian Advanced Air Mobility,General,0.07,0.15,07/29/2021,"Vancouver, BC"
Advanced Manufacturing Cluster,Cluster: Materials Atlantic,Verschuren Centre Inc.,General,0.08,0.15,07/29/2021,"Bedford, NS"
Advanced Manufacturing Cluster,MARIOS - Sustainable Manufacturing,InnoTech Alberta,General,0.07,0.15,07/29/2021,"Edmonton, AB"
Advanced Manufacturing Cluster,Advanced Systems for High Purity Alumina (HPA) Production,"Polar Sapphire Ltd., Nature Alu Inc., Dynamic Concept",General,2.22,5.01,07/28/2021,"Oakville, ON"
Advanced Manufacturing Cluster,Automated inspection system for robotic welding operations,"Autometrics Manufacturing Technologies, Inc., Macron Metalfab Inc.",General,0.19,0.37,07/28/2021,"Vancouver, BC"
Advanced Manufacturing Cluster,Autonomous Adaptable Robot System,"Stronach Centre for Innovation (a division of Magna International Inc.), Maple Advanced Robotics Inc.",General,2.62,5.98,07/28/2021,"Aurora, ON"
Advanced Manufacturing Cluster,Transforming Food Waste Anaerobic Digester into a Bioplastic Manufacturing Hub,"Genecis Bioindustries Inc., StormFisher Ltd.",General,2.68,6.03,07/27/2021,"Scarborough, ON"
Advanced Manufacturing Cluster,Mycionics robotic mushroom harvester,"Mycionics Inc., Whitecrest Mushrooms Ltd., Piccioni Brothers Mushroom Farm Ltd.",General,1.72,3.88,07/07/2021,"Putnam, ON"
Advanced Manufacturing Cluster,"Real Time Asset Monitoring, Optimization & Food Processing Supply Chain Collaboration","Panevo Services Limited, Saputo Dairy Products, Accuenergy",General,1.38,3.72,04/06/2021,"Vancouver, BC"
Advanced Manufacturing Cluster,Array Additive Manufacturing Production System (ARRAY),"Mosaic Manufacturing Ltd., Objex Unlimited, ReDeTec Inc., Athletic Knit",General,2.21,4.98,03/31/2021,"Toronto, ON"
Advanced Manufacturing Cluster,New Advanced Manufacturing Production Environment for Smart Textiles as Medical Devices,"Myant Inc., Applied Brain Research, Urtech Manufacturing Inc.",General,5.46,12.3,03/10/2021,"Toronto, ON"
Advanced Manufacturing Cluster,Feasibility of a New and Innovative Production End-of-Line Tester,"Kepstrum Inc., Stackpole International Engineered Products Ltd.",General,0.1,0.28,03/02/2021,"Vaughan, ON"
Advanced Manufacturing Cluster,AI Powered Visual Quality Inspection,"Quali Artificial Intelligence, Riverside Natural Foods Ltd., Axiom Plastics Inc., Terra Cotta Foods Ltd.",General,0.1,0.2,03/02/2021,"Kitchener, ON"
Advanced Manufacturing Cluster,Advancing Ablation Processes for Automotive Applications,"CG Belle Industries Inc., Spectral Devices Inc.",General,0.17,0.37,03/02/2021,"Oshawa, ON"
Advanced Manufacturing Cluster,AIXEL AIoT Quality Inspection Automation,"AIXEL Inc., Quali Artificial Intelligence",General,0.25,0.5,03/02/2021,"Waterloo, ON"
Advanced Manufacturing Cluster,Advanced Manufacturing for Highly Adaptive Manufacturing Environments,"MDA Corporation, Promark Electronics, AV&R",General,5,11.26,02/18/2021,"Ste-Anne-de-Bellevue, QC"
Advanced Manufacturing Cluster,Novel Application of Advanced Manufacturing Approaches to High Quality Protein,"Aspire Food Group, TELUS, A & L Canada Laboratories Inc., Darwin AI",General,16.8,72.76,02/17/2021,"Toronto, ON"
Advanced Manufacturing Cluster,Pressure molded N95 masks (COVID-19 Project),"Armfoam (Artofix), Roswell DHT",COVID-19,2.44,7.94,01/21/2021,"Longueuil, QC"
Advanced Manufacturing Cluster,PPE gowns made from recycled material (COVID-19 Project),"Carmina De Young, Optima Colour",COVID-19,1.99,3.99,01/21/2021,"London, ON"
Advanced Manufacturing Cluster,Manufacturing medical grade surgical masks (COVID-19 Project),"Fidelity Machine & Mould Solutions, Fidelity Medical Manufacturing, Sentient Tools Engineering Corp",COVID-19,1.51,3.4,01/21/2021,"Calgary, AB"
Advanced Manufacturing Cluster,Scaling up antimicrobial textile material manufacturing for use in PPE applications (COVID-19 Project),"Fine Cotton Factory, Microbonds Inc.",COVID-19,1.39,3.13,01/21/2021,"Etobicoke, ON"
Advanced Manufacturing Cluster,Manufacturing capacity scale up COVID-19 Reagents and Test Kits (COVID-19 Project),"International Point of Care Inc. (IPOC), Precision Biomonitoring Inc., Immune Response Diagnostics Inc., Suncor Energy Inc.",COVID-19,2.17,4.34,01/21/2021,"Toronto, ON"
Advanced Manufacturing Cluster,Manufacturing a N100 face mask using nanofibres (COVID-19 Project),"IPC Technologies dba Prescientx, The Big-Nano Corporation",COVID-19,1.32,2.98,01/21/2021,"Cambridge, ON"
Advanced Manufacturing Cluster,Creating an antimicrobial (silver nano particles) fabric (COVID-19 Project),"McRae Imaging, Dot Automation, Lumentra Inc.",COVID-19,1.8,4.41,01/21/2021,"Mississauga, ON"
Advanced Manufacturing Cluster,Hand sanitizer production system from pellet to pallet (COVID-19 Project),"Molded Precision Components, Niigon Machines Ltd.",COVID-19,6.06,12.12,01/21/2021,"Oro-Medonte, ON"
Advanced Manufacturing Cluster,Creating automated manufacturing equipment and supplying N95 masks (COVID-19 Project),"Novo Textile Company Ltd., Harbour Technologies",COVID-19,0.91,2.4,01/21/2021,"Coquitlam, BC"
Advanced Manufacturing Cluster,COVID-19 mRNA Vaccine (COVID-19 Project),"Providence Therapeutics Holdings Inc., Northern RNA Inc.",COVID-19,5.05,10.1,01/21/2021,"Toronto, ON"
Advanced Manufacturing Cluster,Producing nanofiber meltblown material (COVID-19 Project),"The Big-Nano Corp., Swenco, IPC Technologies dba Prescientx, APC Filtration, Titan Clean Energy Project Corp",COVID-19,1.76,3.53,01/21/2021,"Waterloo, ON"
Advanced Manufacturing Cluster,Creating biodegrable material for N95 masks and HEPA filters (COVID-19 Project),"Titan Clean Energy, Panther Industries Inc., The Big-Nano, Corporation, K+A Potash Canada and Canada Masq Corp.",COVID-19,0.9,1.81,01/21/2021,"Craik, SK"
Advanced Manufacturing Cluster,New PCB Manufacturing Process,"Addem Labs Inc., COREngineering Ltd.",General,0.25,0.5,11/16/2020,"Toronto, ON"
Advanced Manufacturing Cluster,Zero Transition Process,"Axiom Group Inc., MS Falcon Tooling Inc., Kytech Machine Works Ltd., Bulldog Polymers Inc.",General,0.88,1.98,11/16/2020,"Aurora, ON"
Advanced Manufacturing Cluster,Cluster Digital Transformation Program,Blue Water Wood Alliance,General,0.07,0.13,11/16/2020,"Hanover, ON"
Advanced Manufacturing Cluster,Module for Digitalizing Work Instructions to Augmented Reality,"DeepSight, Avior Integrated Products Inc.",General,0.17,0.34,11/16/2020,"Montreal, QC"
Advanced Manufacturing Cluster,Saskatchewan Industrial Mining Supplier Association (SIMSA) Digital,Saskatchewan Industrial Mining Suppliers Association,General,0.08,0.15,09/28/2020,"Saskatoon, SK"
Advanced Manufacturing Cluster,AI-enabled RoboticHand with Human-level Dexterity for Assembly,"Sanctuary Cognitive Systems Corp., ForceN Inc., Dr. Christopher Doherty M.D. MPH FRCSC (Western University)",General,0.25,0.51,09/15/2020,"Vancouver, BC"
Advanced Manufacturing Cluster,Integrating Automation for Scale up of Carbon Fibre Cascade Production,"Formula Solutions Inc. (FSI), AXYZ Automation Group, Promation",General,3.63,8.17,09/15/2020,"Burlington, ON"
Advanced Manufacturing Cluster,Technology Feasibility Demonstration for Stroke Diagnosis,"Artificial Intelligence Imaging Sensors (AiimSense Inc.), Sorena Tech Corporation",General,0.06,0.11,09/15/2020,"Waterloo, ON"
Advanced Manufacturing Cluster,Repurposing Anaesthesia Machines to Ventilators (COVID-19 Project),DMF Medical,COVID-19,0.28,0.55,08/25/2020,"Dartmouth, NS"
Advanced Manufacturing Cluster,COVID-19 RNA Test Kit (COVID-19 Project),LuminUltra Technologies,COVID-19,2.86,4.61,08/25/2020,"Fredericton, NB"
Advanced Manufacturing Cluster,DPX-COVID-19: Manufacturing and scale up of neutralizing-epitope based synthetic vaccine (COVID-19 Project),Immunovaccine Technologies Inc.,COVID-19,2.5,5.05,08/05/2020,"Dartmouth, NS"
Advanced Manufacturing Cluster,Development and validation of automated patient specific medical device software to improve additive manufacturability,"Orthopedic Innovation Centre, Pega Medical Inc., Spinologics, Conceptualiz, Precision ADM Inc.",General,3.43,7.73,07/08/2020,"Winnipeg, MB"
Advanced Manufacturing Cluster,Advancing large steel press technology,"Conrex, Macrodyne Technologies Inc., Source Industrial Services Inc.",General,3.49,7.88,07/08/2020,"Etobicoke, ON"
Advanced Manufacturing Cluster,Digital transformation of secondary metallurgy facility at ArcelorMittal Dofasco,"ArcelorMittal Dofasco, IBM Canada Ltd., Tenova Goodfellow Inc. and IFIVEO Canada Inc.",General,3.91,12.07,07/08/2020,"Hamilton, ON"
Advanced Manufacturing Cluster,Advanced manufacturing applications in mining and mineral processing,"Exergy Solutions, Suncor Energy, Precision ADM Inc.",General,2.14,4.82,07/08/2020,"Calgary, AB"
Advanced Manufacturing Cluster,Development and Testing of Cube Molding Methodology,"Molded Precision Components, Niigon Machines Ltd",General,0.25,0.5,07/08/2020,"Oro-Medonte, ON"
Advanced Manufacturing Cluster,Advancing Large-scale Graphene and Thin-film Membrane Manufacturing,"Evercloak Inc., Zen Graphene Solutions",General,0.25,0.5,07/08/2020,"Kitchener, ON"
Advanced Manufacturing Cluster,"Pilot scale of Nanogel Lubricants, or Superabsorbent (SAC) Lubrication for the Automotive Stamping Industry","KSL Lubricants, Wolfdale Tool & Stamping",General,0.14,0.32,07/08/2020,"Mississauga, ON"
Advanced Manufacturing Cluster,Roll to Roll Continuous Printing of Transparent Conductors and Heaters,"Nano Cnet Ltd., Evercloak Inc.",General,0.25,0.5,07/08/2020,"Waterloo, ON"
Advanced Manufacturing Cluster,Real-time Overall Equipment Effectiveness Monitoring & Optimization,"Panevo Services Limited, Accuenergy Canada Inc",General,0.13,0.26,07/08/2020,"Vancouver, BC"
Advanced Manufacturing Cluster,Autonomous mobile robotic UV disinfector (AMRUD) (COVID-19 Project),A&K Robotics,COVID-19,0.76,1.52,07/06/2020,"Vancouver, BC"
Advanced Manufacturing Cluster,Disinfection Robot (COVID-19 Project),Advanced Intelligent Systems Inc.,COVID-19,0.98,1.95,07/06/2020,"Burnaby, BC"
Advanced Manufacturing Cluster,Cleanbot (COVID-19 Project),Crosswing,COVID-19,1.6,3.48,07/06/2020,"Aurora, ON"
Advanced Manufacturing Cluster,Disinfection Service Robot (DSR) Solution (COVID-19 Project),Global DWS Corp,COVID-19,1,2.09,07/06/2020,"Toronto, ON"
Advanced Manufacturing Cluster,Autonomous Mobile UV-Light Emitting Robotic Vehicle (COVID-19 Project),"Prescientx, Clearpath Robotics",COVID-19,0.7,1.5,07/06/2020,"Kitchener, ON"
Advanced Manufacturing Cluster,Remote Monitoring for Patients at Home (COVID-19 Project),Cloud Diagnostics,COVID-19,1.76,3.51,06/20/2020,"Kitchener, ON"
Advanced Manufacturing Cluster,Fast manufacturing of plastic injection molds for COVID-19 diagnostic and treatment (COVID-19 Project),ExaCad,COVID-19,1.83,1.97,06/20/2020,"Boisbriand, QC"
Advanced Manufacturing Cluster,Smart Garments for Biometric Monitoring (COVID-19 Project),"Myant, Celestica, Bayshore, CardioComm Solutions",COVID-19,2.49,5.06,06/20/2020,"Toronto, ON"
Advanced Manufacturing Cluster,RNA Viral Detection Kits (COVID-19 Project),"Precision Biomonitoring, Evik Diagnostics",COVID-19,4.55,4.72,06/02/2020,"Guelph, ON"
Advanced Manufacturing Cluster,N95 Respirator Mask Automation (COVID-19 Project),Eclipse Automation,COVID-19,2.11,2.99,05/20/2020,"Cambridge, ON"
Advanced Manufacturing Cluster,Ventilator Components (COVID-19 Project),"BOMImed, Synergy Mouldworks, Precision ADM",COVID-19,0.93,0.98,04/03/2020,"Winnipeg, MB"
Advanced Manufacturing Cluster,Self-Sterilization Coating Materials (COVID-19 Project),Envision SQ,COVID-19,1.5,1.74,04/03/2020,"Guelph, ON"
Advanced Manufacturing Cluster,Precision Molded Personal Protection Visor (COVID-19 Project),"Molded Precision Components (MPC), Sterling Industries",COVID-19,4.93,4.93,04/03/2020,"Toronto, ON"
Advanced Manufacturing Cluster,3D-Printed face shields (COVID-19 Project),"Mosaic Manufacturing, Glia Inc., Rockmass Technologies Inc., Redetec Inc.",COVID-19,0.43,0.43,04/03/2020,"Toronto, ON"
Advanced Manufacturing Cluster,Accelerated Test Kits for Point-of-Care (COVID-19 Project),Response Biomedical,COVID-19,2.74,2.74,04/03/2020,"Vancouver, BC"
Advanced Manufacturing Cluster,Face shields using 3D printing (COVID-19 Project),Burloak Technologies,COVID-19,1.14,1.31,03/31/2020,"Oakville, ON"
Advanced Manufacturing Cluster,Rapid Test Kits (COVID-19 Project),Sona Nanotech,COVID-19,3.9,3.9,03/31/2020,"Halifax, NS"
Advanced Manufacturing Cluster,Open-source ventilator design (COVID-19 Project),"Starfish Medical, Linamar-MacDon and Cerebra Health, Product Creation Studio",COVID-19,5,5,03/31/2020,"Victoria, BC"
